{
  "timestamp": "20250819_101548",
  "model": "gpt-3.5-turbo",
  "prompt_preview": "You are a newsroom fact-checker verifying event information for photojournalists.\n\nCURRENT DATE: 2025-08-19\n\nPRIMARY TASK: Extract unique events with complete, actionable information that photographers can use to plan their coverage.\n\nEVENTS TO PROCESS:\n[\n  {\n    \"id\": 1,\n    \"url\": \"https://www.cnn.com/2025/06/23/politics/zohran-mamdani-mayor-new-york-city-primary\",\n    \"title\": \"Who is Zohran Mamdani, the socialist leading New York's ... - CNN\",\n    \"snippet\": \"Zohran Mamdani could barely walk...",
  "raw_response": "```json\n[\n    {\n        \"id\": 1,\n        \"title\": \"Who is Zohran Mamdani, the socialist leading New York's ...\",\n        \"date\": null,\n        \"time\": null,\n        \"location\": null,\n        \"organizer\": null,\n        \"access_req\": null,\n        \"summary\": \"Zohran Mamdani could barely walk a few feet at a recent Juneteenth festival in Queens without a crowd of selfie-demanding admirers trying to stop him.\",\n        \"has_basic_info\": false,\n        \"is_duplicate_of\": null,\n        \"is_past_event\": false,\n        \"source_url\": \"https://www.cnn.com/2025/06/23/politics/zohran-mamdani-mayor-new-york-city-primary\"\n    },\n    {\n        \"id\": 2,\n        \"title\": \"'We've had enough': Texas Democrat who slept on state House ...\",\n        \"date\": null,\n        \"time\": null,\n        \"location\": null,\n        \"organizer\": null,\n        \"access_req\": null,\n        \"summary\": \"Rep. Nicole Collier (D-TX) spent the night on the Texas House floor in protest after refusing a Republican demand to be placed under the watch of the state Department of Public Safety. CNN's\",\n        \"has_basic_info\": false,\n        \"is_duplicate_of\": null,\n        \"is_past_event\": false,\n        \"source_url\": \"https://www.cnn.com/2025/08/19/politics/video/texas-democrat-nicole-collier-sleeps-texas-house-floor-redistricting-digvid\"\n    },\n    {\n        \"id\": 3,\n        \"title\": \"Musk's X says it won't cooperate with 'politically motivated' French ...\",\n        \"date\": \"2025-07-21\",\n        \"time\": \"08:53\",\n        \"location\": null,\n        \"organizer\": null,\n        \"access_req\": null,\n        \"summary\": \"Elon Musk's X on Monday accused French prosecutors of launching a \\\"politically-motivated criminal investigation\\\" that threatens its users' free speech, denying all allegations against it and\",\n        \"has_basic_info\": false,\n        \"is_duplicate_of\": null,\n        \"is_past_event\": true,\n        \"source_url\": \"https://www.reuters.com/legal/litigation/musks-x-says-it-wont-cooperate-with-politically-motivated-french-probe-2025-07-21/\"\n    },\n    {\n        \"id\": 4,\n        \"title\": \"X Ads | Tools to fit your business needs - Twitter\",\n        \"date\": null,\n        \"time\": null,\n        \"location\": null,\n        \"organizer\": null,\n        \"access_req\": null,\n        \"summary\": \"Setup is simple Step 1 Select your business objective Step 2 Choose your target audience Step 3 Set a budget and pay for what works Step 4 Measure and optimize your\",\n        \"has_basic_info\": false,\n        \"is_duplicate_of\": null,\n        \"is_past_event\": false,\n        \"source_url\": \"https://ads.twitter.com/getstarted\"\n    },\n    {\n        \"id\": 5,\n        \"title\": \"X API tools - Twitter Developer Platform\",\n        \"date\": null,\n        \"time\": null,\n        \"location\": null,\n        \"organizer\": null,\n        \"access_req\": null,\n        \"summary\": \"Ready to build what's next? Send your first request by signing up for the X API.\",\n        \"has_basic_info\": false,\n        \"is_duplicate_of\": null,\n        \"is_past_event\": false,\n        \"source_url\": \"https://developer.twitter.com/apitools/\"\n    },\n    {\n        \"id\": 6,\n        \"title\": \"X's tumultuous journey under Elon Musk | Reuters\",\n        \"date\": \"2025-07-09\",\n        \"time\": null,\n        \"location\": null,\n        \"organizer\": null,\n        \"access_req\": null,\n        \"summary\": \"The CEO of X, Linda Yaccarino, said on Wednesday she would step down from the role in a surprise move, ending her tenure at the Elon Musk-owned social media platform that has faced several\",\n        \"has_basic_info\": false,\n        \"is_duplicate_of\": null,\n        \"is_past_event\": true,\n        \"source_url\": \"https://www.reuters.com/business/autos-transportation/xs-tumultuous-journey-under-elon-musk-2025-07-09/\"\n    },\n    {\n        \"id\": 7,\n        \"title\": \"Linda Yaccarino is leaving Elon Musk's X after two years as CEO\",\n        \"date\": \"2025-07-09\",\n        \"time\": \"14:49\",\n        \"location\": null,\n        \"organizer\": null,\n        \"access_req\": null,\n        \"summary\": \"Linda Yaccarino is stepping down as CEO of X after two years leading Elon Musk's social media company.\",\n        \"has_basic_info\": false,\n        \"is_duplicate_of\": null,\n        \"is_past_event\": true,\n        \"source_url\": \"https://www.cnn.com/2025/07/09/tech/linda-yaccarino-steps-down-x-ceo\"\n    },\n    {\n        \"id\": 8,\n        \"title\": \"Musk-owned X's CEO Yaccarino to step down in surprise move\",\n        \"date\": null,\n        \"time\": null,\n        \"location\": null,\n        \"organizer\": null,\n        \"access_req\": null,\n        \"summary\": \"Linda Yaccarino's departure adds to turbulence in Elon Musk's sprawling business empire.\",\n        \"has_basic_info\": false,\n        \"is_duplicate_of\": null,\n        \"is_past_event\": false,\n        \"source_url\": \"https://www.reuters.com/sustainability/boards-policy-regulation/x-ceo-yaccarino-step-down-surprise-move-2025-07-09/\"\n    },\n    {\n        \"id\": 9,\n        \"title\": \"Judge blocks Trump FTC's 'retaliation' against Media Matters - CNN\",\n        \"date\": \"2025-08-16\",\n        \"time\": null,\n        \"location\": null,\n        \"organizer\": null,\n        \"access_req\": null,\n        \"summary\": \"A federal judge has blocked the Trump administration's investigation of a liberal group known for its campaigns against Fox News and Elon Musk's X.\",\n        \"has_basic_info\": false,\n        \"is_duplicate_of\": null,\n        \"is_past_event\": false,\n        \"source_url\": \"https://www.cnn.com/2025/08/16/media/ftc-trump-media-matters-elon-musk-judge-order\"\n    },\n    {\n        \"id\": 10,\n        \"title\": \"X removes posts by Musk chatbot Grok after antisemitism complaints\",\n        \"date\": \"2025-07-09\",\n        \"time\": \"03:44\",\n        \"location\": null,\n        \"organizer\": null,\n        \"access_req\": null,\n        \"summary\": \"Social media posts on the X account of the Grok chatbot developed by Elon Musk's company xAI were removed on Tuesday after complaints from X users and the Anti-Defamation League that Grok\",\n        \"has_basic_info\": false,\n        \"is_duplicate_of\": null,\n        \"is_past_event\": true,\n        \"source_url\": \"https://www.reuters.com/technology/musk-chatbot-grok-removes-posts-after-complaints-antisemitism-2025-07-09/\"\n    }\n]\n```",
  "parsed_events": [
    {
      "id": 1,
      "title": "Who is Zohran Mamdani, the socialist leading New York's ...",
      "date": null,
      "time": null,
      "location": null,
      "organizer": null,
      "access_req": null,
      "summary": "Zohran Mamdani could barely walk a few feet at a recent Juneteenth festival in Queens without a crowd of selfie-demanding admirers trying to stop him.",
      "has_basic_info": false,
      "is_duplicate_of": null,
      "is_past_event": false,
      "source_url": "https://www.cnn.com/2025/06/23/politics/zohran-mamdani-mayor-new-york-city-primary"
    },
    {
      "id": 2,
      "title": "'We've had enough': Texas Democrat who slept on state House ...",
      "date": null,
      "time": null,
      "location": null,
      "organizer": null,
      "access_req": null,
      "summary": "Rep. Nicole Collier (D-TX) spent the night on the Texas House floor in protest after refusing a Republican demand to be placed under the watch of the state Department of Public Safety. CNN's",
      "has_basic_info": false,
      "is_duplicate_of": null,
      "is_past_event": false,
      "source_url": "https://www.cnn.com/2025/08/19/politics/video/texas-democrat-nicole-collier-sleeps-texas-house-floor-redistricting-digvid"
    },
    {
      "id": 3,
      "title": "Musk's X says it won't cooperate with 'politically motivated' French ...",
      "date": "2025-07-21",
      "time": "08:53",
      "location": null,
      "organizer": null,
      "access_req": null,
      "summary": "Elon Musk's X on Monday accused French prosecutors of launching a \"politically-motivated criminal investigation\" that threatens its users' free speech, denying all allegations against it and",
      "has_basic_info": false,
      "is_duplicate_of": null,
      "is_past_event": true,
      "source_url": "https://www.reuters.com/legal/litigation/musks-x-says-it-wont-cooperate-with-politically-motivated-french-probe-2025-07-21/"
    },
    {
      "id": 4,
      "title": "X Ads | Tools to fit your business needs - Twitter",
      "date": null,
      "time": null,
      "location": null,
      "organizer": null,
      "access_req": null,
      "summary": "Setup is simple Step 1 Select your business objective Step 2 Choose your target audience Step 3 Set a budget and pay for what works Step 4 Measure and optimize your",
      "has_basic_info": false,
      "is_duplicate_of": null,
      "is_past_event": false,
      "source_url": "https://ads.twitter.com/getstarted"
    },
    {
      "id": 5,
      "title": "X API tools - Twitter Developer Platform",
      "date": null,
      "time": null,
      "location": null,
      "organizer": null,
      "access_req": null,
      "summary": "Ready to build what's next? Send your first request by signing up for the X API.",
      "has_basic_info": false,
      "is_duplicate_of": null,
      "is_past_event": false,
      "source_url": "https://developer.twitter.com/apitools/"
    },
    {
      "id": 6,
      "title": "X's tumultuous journey under Elon Musk | Reuters",
      "date": "2025-07-09",
      "time": null,
      "location": null,
      "organizer": null,
      "access_req": null,
      "summary": "The CEO of X, Linda Yaccarino, said on Wednesday she would step down from the role in a surprise move, ending her tenure at the Elon Musk-owned social media platform that has faced several",
      "has_basic_info": false,
      "is_duplicate_of": null,
      "is_past_event": true,
      "source_url": "https://www.reuters.com/business/autos-transportation/xs-tumultuous-journey-under-elon-musk-2025-07-09/"
    },
    {
      "id": 7,
      "title": "Linda Yaccarino is leaving Elon Musk's X after two years as CEO",
      "date": "2025-07-09",
      "time": "14:49",
      "location": null,
      "organizer": null,
      "access_req": null,
      "summary": "Linda Yaccarino is stepping down as CEO of X after two years leading Elon Musk's social media company.",
      "has_basic_info": false,
      "is_duplicate_of": null,
      "is_past_event": true,
      "source_url": "https://www.cnn.com/2025/07/09/tech/linda-yaccarino-steps-down-x-ceo"
    },
    {
      "id": 8,
      "title": "Musk-owned X's CEO Yaccarino to step down in surprise move",
      "date": null,
      "time": null,
      "location": null,
      "organizer": null,
      "access_req": null,
      "summary": "Linda Yaccarino's departure adds to turbulence in Elon Musk's sprawling business empire.",
      "has_basic_info": false,
      "is_duplicate_of": null,
      "is_past_event": false,
      "source_url": "https://www.reuters.com/sustainability/boards-policy-regulation/x-ceo-yaccarino-step-down-surprise-move-2025-07-09/"
    },
    {
      "id": 9,
      "title": "Judge blocks Trump FTC's 'retaliation' against Media Matters - CNN",
      "date": "2025-08-16",
      "time": null,
      "location": null,
      "organizer": null,
      "access_req": null,
      "summary": "A federal judge has blocked the Trump administration's investigation of a liberal group known for its campaigns against Fox News and Elon Musk's X.",
      "has_basic_info": false,
      "is_duplicate_of": null,
      "is_past_event": false,
      "source_url": "https://www.cnn.com/2025/08/16/media/ftc-trump-media-matters-elon-musk-judge-order"
    },
    {
      "id": 10,
      "title": "X removes posts by Musk chatbot Grok after antisemitism complaints",
      "date": "2025-07-09",
      "time": "03:44",
      "location": null,
      "organizer": null,
      "access_req": null,
      "summary": "Social media posts on the X account of the Grok chatbot developed by Elon Musk's company xAI were removed on Tuesday after complaints from X users and the Anti-Defamation League that Grok",
      "has_basic_info": false,
      "is_duplicate_of": null,
      "is_past_event": true,
      "source_url": "https://www.reuters.com/technology/musk-chatbot-grok-removes-posts-after-complaints-antisemitism-2025-07-09/"
    }
  ],
  "token_usage": {
    "completion_tokens": 1627,
    "prompt_tokens": 5944,
    "total_tokens": 7571,
    "completion_tokens_details": {
      "accepted_prediction_tokens": 0,
      "audio_tokens": 0,
      "reasoning_tokens": 0,
      "rejected_prediction_tokens": 0
    },
    "prompt_tokens_details": {
      "audio_tokens": 0,
      "cached_tokens": 0
    }
  },
  "estimated_cost": 0.0018678
}