{
  "timestamp": "20250818_230227",
  "model": "gpt-3.5-turbo",
  "prompt_preview": "You are a newsroom fact-checker verifying event information for photojournalists.\n\nCURRENT DATE: 2025-08-18\n\nPRIMARY TASK: Extract unique events with complete, actionable information that photographers can use to plan their coverage.\n\nEVENTS TO PROCESS:\n[\n  {\n    \"id\": 1,\n    \"url\": \"https://www.instagram.com/reel/DNRUVVwBQha/\",\n    \"title\": \"\\ufe0fNOW IN NYC - Instagram\",\n    \"snippet\": \"1589 likes, 32 comments - peoplesforumnyc on August 12, 2025: \\\" \\u203c\\ufe0fNOW IN NYC: Protesters rally ou...",
  "raw_response": "```json\n[\n    {\n        \"id\": 1,\n        \"title\": \"Protesters Rally Outside New York Times\",\n        \"date\": \"2025-08-12\",\n        \"time\": null,\n        \"location\": \"New York Times Building, NYC\",\n        \"organizer\": \"Peoples Forum NYC\",\n        \"access_req\": \"open to all\",\n        \"summary\": \"Protesters rally outside the New York Times building.\",\n        \"has_basic_info\": false,\n        \"is_duplicate_of\": null,\n        \"is_past_event\": true,\n        \"source_url\": \"https://www.instagram.com/reel/DNRUVVwBQha/\"\n    },\n    {\n        \"id\": 2,\n        \"title\": \"STOP STARVING GAZA: Mass March For Humanity\",\n        \"date\": \"2025-08-16\",\n        \"time\": null,\n        \"location\": \"New York City\",\n        \"organizer\": \"NYC Protest Coverage\",\n        \"access_req\": \"open to all\",\n        \"summary\": \"Mahmoud Khalil speaks during the mass march for humanity.\",\n        \"has_basic_info\": false,\n        \"is_duplicate_of\": null,\n        \"is_past_event\": true,\n        \"source_url\": \"https://www.instagram.com/nycprotestcoverage/\"\n    },\n    {\n        \"id\": 3,\n        \"title\": \"Week of Action to Stop Big Oil\",\n        \"date\": \"2025-07-25\",\n        \"time\": null,\n        \"location\": \"NYC\",\n        \"organizer\": \"50501NY\",\n        \"access_req\": \"open to all\",\n        \"summary\": \"Join a week of action to stop Big Oil billionaires and fund communities.\",\n        \"has_basic_info\": false,\n        \"is_duplicate_of\": null,\n        \"is_past_event\": true,\n        \"source_url\": \"https://www.instagram.com/p/DMjLw9iOMpR/\"\n    },\n    {\n        \"id\": 4,\n        \"title\": \"NYC Pride March 2025\",\n        \"date\": \"2025-06-29\",\n        \"time\": \"11:00\",\n        \"location\": \"New York City\",\n        \"organizer\": \"The New York Times\",\n        \"access_req\": \"open to all\",\n        \"summary\": \"Official Pride march starting under the theme 'Rise Up: Pride in Protest.'\",\n        \"has_basic_info\": true,\n        \"is_duplicate_of\": null,\n        \"is_past_event\": true,\n        \"source_url\": \"https://www.nytimes.com/2025/05/29/arts/pride-events-nyc.html\"\n    },\n    {\n        \"id\": 5,\n        \"title\": \"Nationwide Protests Against Trump's Policies\",\n        \"date\": \"2025-08-16\",\n        \"time\": null,\n        \"location\": \"Across the country\",\n        \"organizer\": \"Associated Press\",\n        \"access_req\": \"open to all\",\n        \"summary\": \"Nationwide protests against Trump's immigration crackdown and health care cuts.\",\n        \"has_basic_info\": false,\n        \"is_duplicate_of\": null,\n        \"is_past_event\": true,\n        \"source_url\": \"https://www.cnn.com/2025/07/17/us/good-trouble-john-lewis-protests-trump-hnk\"\n    },\n    {\n        \"id\": 6,\n        \"title\": \"The Week Ahead at the United Nations\",\n        \"date\": \"2025-08-16\",\n        \"time\": \"08:00\",\n        \"location\": \"United Nations Headquarters, NYC\",\n        \"organizer\": \"United Nations\",\n        \"access_req\": \"open to all\",\n        \"summary\": \"Overview of events at the United Nations for the week.\",\n        \"has_basic_info\": true,\n        \"is_duplicate_of\": null,\n        \"is_past_event\": true,\n        \"source_url\": \"https://www.un.org/sg/en/content/the-week-ahead-the-united-nations\"\n    },\n    {\n        \"id\": 7,\n        \"title\": \"Fight the Takeover Rally\",\n        \"date\": \"2025-08-16\",\n        \"time\": null,\n        \"location\": \"Hudson, NY\",\n        \"organizer\": \"dan.scheffey\",\n        \"access_req\": \"open to all\",\n        \"summary\": \"Rally to fight against the takeover in Hudson, NY.\",\n        \"has_basic_info\": false,\n        \"is_duplicate_of\": null,\n        \"is_past_event\": true,\n        \"source_url\": \"https://www.instagram.com/p/DNbd7fxBHrA/\"\n    },\n    {\n        \"id\": 8,\n        \"title\": \"Week of Action for Palestine in NYC\",\n        \"date\": \"2025-08-18\",\n        \"time\": null,\n        \"location\": \"NYC\",\n        \"organizer\": \"Unknown\",\n        \"access_req\": \"open to all\",\n        \"summary\": \"Join a week of action for Palestine in NYC.\",\n        \"has_basic_info\": false,\n        \"is_duplicate_of\": null,\n        \"is_past_event\": false,\n        \"source_url\": \"https://www.instagram.com/p/DJefxBJtsPU/\"\n    },\n    {\n        \"id\": 9,\n        \"title\": \"Stop Starving Gaza Protest\",\n        \"date\": \"2025-08-18\",\n        \"time\": null,\n        \"location\": \"New York Public Library, Bryant Park, NYC\",\n        \"organizer\": \"The People's Forum\",\n        \"access_req\": \"open to all\",\n        \"summary\": \"Thousands rally at the Stop Starving Gaza protest.\",\n        \"has_basic_info\": false,\n        \"is_duplicate_of\": null,\n        \"is_past_event\": false,\n        \"source_url\": \"https://twitter.com/PeoplesForumNYC\"\n    },\n    {\n        \"id\": 10,\n        \"title\": \"FOX: STOP THE LIES! Protest\",\n        \"date\": \"2025-03-30\",\n        \"time\": \"12:00\",\n        \"location\": \"Fox News Headquarters, NYC\",\n        \"organizer\": \"Unknown\",\n        \"access_req\": \"open to all\",\n        \"summary\": \"Nonviolent protest titled 'FOX: STOP THE LIES!' at Fox News.\",\n        \"has_basic_info\": true,\n        \"is_duplicate_of\": null,\n        \"is_past_event\": true,\n        \"source_url\": \"https://www.instagram.com/p/DHq0CbPRv1i/\"\n    }\n]\n```",
  "parsed_events": [
    {
      "id": 1,
      "title": "Protesters Rally Outside New York Times",
      "date": "2025-08-12",
      "time": null,
      "location": "New York Times Building, NYC",
      "organizer": "Peoples Forum NYC",
      "access_req": "open to all",
      "summary": "Protesters rally outside the New York Times building.",
      "has_basic_info": false,
      "is_duplicate_of": null,
      "is_past_event": true,
      "source_url": "https://www.instagram.com/reel/DNRUVVwBQha/"
    },
    {
      "id": 2,
      "title": "STOP STARVING GAZA: Mass March For Humanity",
      "date": "2025-08-16",
      "time": null,
      "location": "New York City",
      "organizer": "NYC Protest Coverage",
      "access_req": "open to all",
      "summary": "Mahmoud Khalil speaks during the mass march for humanity.",
      "has_basic_info": false,
      "is_duplicate_of": null,
      "is_past_event": true,
      "source_url": "https://www.instagram.com/nycprotestcoverage/"
    },
    {
      "id": 3,
      "title": "Week of Action to Stop Big Oil",
      "date": "2025-07-25",
      "time": null,
      "location": "NYC",
      "organizer": "50501NY",
      "access_req": "open to all",
      "summary": "Join a week of action to stop Big Oil billionaires and fund communities.",
      "has_basic_info": false,
      "is_duplicate_of": null,
      "is_past_event": true,
      "source_url": "https://www.instagram.com/p/DMjLw9iOMpR/"
    },
    {
      "id": 4,
      "title": "NYC Pride March 2025",
      "date": "2025-06-29",
      "time": "11:00",
      "location": "New York City",
      "organizer": "The New York Times",
      "access_req": "open to all",
      "summary": "Official Pride march starting under the theme 'Rise Up: Pride in Protest.'",
      "has_basic_info": true,
      "is_duplicate_of": null,
      "is_past_event": true,
      "source_url": "https://www.nytimes.com/2025/05/29/arts/pride-events-nyc.html"
    },
    {
      "id": 5,
      "title": "Nationwide Protests Against Trump's Policies",
      "date": "2025-08-16",
      "time": null,
      "location": "Across the country",
      "organizer": "Associated Press",
      "access_req": "open to all",
      "summary": "Nationwide protests against Trump's immigration crackdown and health care cuts.",
      "has_basic_info": false,
      "is_duplicate_of": null,
      "is_past_event": true,
      "source_url": "https://www.cnn.com/2025/07/17/us/good-trouble-john-lewis-protests-trump-hnk"
    },
    {
      "id": 6,
      "title": "The Week Ahead at the United Nations",
      "date": "2025-08-16",
      "time": "08:00",
      "location": "United Nations Headquarters, NYC",
      "organizer": "United Nations",
      "access_req": "open to all",
      "summary": "Overview of events at the United Nations for the week.",
      "has_basic_info": true,
      "is_duplicate_of": null,
      "is_past_event": true,
      "source_url": "https://www.un.org/sg/en/content/the-week-ahead-the-united-nations"
    },
    {
      "id": 7,
      "title": "Fight the Takeover Rally",
      "date": "2025-08-16",
      "time": null,
      "location": "Hudson, NY",
      "organizer": "dan.scheffey",
      "access_req": "open to all",
      "summary": "Rally to fight against the takeover in Hudson, NY.",
      "has_basic_info": false,
      "is_duplicate_of": null,
      "is_past_event": true,
      "source_url": "https://www.instagram.com/p/DNbd7fxBHrA/"
    },
    {
      "id": 8,
      "title": "Week of Action for Palestine in NYC",
      "date": "2025-08-18",
      "time": null,
      "location": "NYC",
      "organizer": "Unknown",
      "access_req": "open to all",
      "summary": "Join a week of action for Palestine in NYC.",
      "has_basic_info": false,
      "is_duplicate_of": null,
      "is_past_event": false,
      "source_url": "https://www.instagram.com/p/DJefxBJtsPU/"
    },
    {
      "id": 9,
      "title": "Stop Starving Gaza Protest",
      "date": "2025-08-18",
      "time": null,
      "location": "New York Public Library, Bryant Park, NYC",
      "organizer": "The People's Forum",
      "access_req": "open to all",
      "summary": "Thousands rally at the Stop Starving Gaza protest.",
      "has_basic_info": false,
      "is_duplicate_of": null,
      "is_past_event": false,
      "source_url": "https://twitter.com/PeoplesForumNYC"
    },
    {
      "id": 10,
      "title": "FOX: STOP THE LIES! Protest",
      "date": "2025-03-30",
      "time": "12:00",
      "location": "Fox News Headquarters, NYC",
      "organizer": "Unknown",
      "access_req": "open to all",
      "summary": "Nonviolent protest titled 'FOX: STOP THE LIES!' at Fox News.",
      "has_basic_info": true,
      "is_duplicate_of": null,
      "is_past_event": true,
      "source_url": "https://www.instagram.com/p/DHq0CbPRv1i/"
    }
  ],
  "token_usage": {
    "completion_tokens": 1387,
    "prompt_tokens": 6538,
    "total_tokens": 7925,
    "completion_tokens_details": {
      "accepted_prediction_tokens": 0,
      "audio_tokens": 0,
      "reasoning_tokens": 0,
      "rejected_prediction_tokens": 0
    },
    "prompt_tokens_details": {
      "audio_tokens": 0,
      "cached_tokens": 0
    }
  },
  "estimated_cost": 0.0018128999999999999
}