{
  "timestamp": "20250819_101526",
  "model": "gpt-3.5-turbo",
  "prompt_preview": "You are a newsroom fact-checker verifying event information for photojournalists.\n\nCURRENT DATE: 2025-08-19\n\nPRIMARY TASK: Extract unique events with complete, actionable information that photographers can use to plan their coverage.\n\nEVENTS TO PROCESS:\n[\n  {\n    \"id\": 1,\n    \"url\": \"https://www.cnn.com/2025/06/23/politics/zohran-mamdani-mayor-new-york-city-primary\",\n    \"title\": \"Who is Zohran Mamdani, the socialist leading New York's ... - CNN\",\n    \"snippet\": \"Zohran Mamdani could barely walk...",
  "raw_response": "```json\n[\n    {\n        \"id\": 1,\n        \"title\": \"Zohran Mamdani at Juneteenth Festival in Queens\",\n        \"date\": \"2025-06-23\",\n        \"time\": null,\n        \"location\": \"Queens, NYC\",\n        \"organizer\": null,\n        \"access_req\": \"unknown\",\n        \"summary\": \"Zohran Mamdani attracting crowds at Juneteenth festival in Queens.\",\n        \"has_basic_info\": false,\n        \"is_duplicate_of\": null,\n        \"is_past_event\": true,\n        \"source_url\": \"https://www.cnn.com/2025/06/23/politics/zohran-mamdani-mayor-new-york-city-primary\"\n    },\n    {\n        \"id\": 2,\n        \"title\": \"Nicole Collier's Protest at Texas House Floor\",\n        \"date\": \"2025-08-19\",\n        \"time\": null,\n        \"location\": \"Texas House floor, Texas\",\n        \"organizer\": null,\n        \"access_req\": \"unknown\",\n        \"summary\": \"Rep. Nicole Collier protests on Texas House floor overnight.\",\n        \"has_basic_info\": false,\n        \"is_duplicate_of\": null,\n        \"is_past_event\": false,\n        \"source_url\": \"https://www.cnn.com/2025/08/19/politics/video/texas-democrat-nicole-collier-sleeps-texas-house-floor-redistricting-digvid\"\n    },\n    {\n        \"id\": 3,\n        \"title\": \"Elon Musk's X Refuses Cooperation with French Probe\",\n        \"date\": \"2025-07-21\",\n        \"time\": \"08:53\",\n        \"location\": \"France\",\n        \"organizer\": null,\n        \"access_req\": \"unknown\",\n        \"summary\": \"Musk's X denies cooperation with 'politically motivated' French probe.\",\n        \"has_basic_info\": true,\n        \"is_duplicate_of\": null,\n        \"is_past_event\": true,\n        \"source_url\": \"https://www.reuters.com/legal/litigation/musks-x-says-it-wont-cooperate-with-politically-motivated-french-probe-2025-07-21/\"\n    },\n    {\n        \"id\": 4,\n        \"title\": \"X Ads Tools for Business\",\n        \"date\": null,\n        \"time\": null,\n        \"location\": null,\n        \"organizer\": null,\n        \"access_req\": \"unknown\",\n        \"summary\": \"Twitter offers tools for businesses to reach their target audience.\",\n        \"has_basic_info\": false,\n        \"is_duplicate_of\": null,\n        \"is_past_event\": false,\n        \"source_url\": \"https://ads.twitter.com/getstarted\"\n    },\n    {\n        \"id\": 5,\n        \"title\": \"X API Tools for Developers\",\n        \"date\": null,\n        \"time\": null,\n        \"location\": null,\n        \"organizer\": null,\n        \"access_req\": \"unknown\",\n        \"summary\": \"Developers can access Twitter's API tools to build innovative applications.\",\n        \"has_basic_info\": false,\n        \"is_duplicate_of\": null,\n        \"is_past_event\": false,\n        \"source_url\": \"https://developer.twitter.com/apitools/\"\n    },\n    {\n        \"id\": 6,\n        \"title\": \"Linda Yaccarino Steps Down as X CEO\",\n        \"date\": \"2025-07-09\",\n        \"time\": \"14:49\",\n        \"location\": \"Elon Musk's X, NYC\",\n        \"organizer\": null,\n        \"access_req\": \"unknown\",\n        \"summary\": \"Linda Yaccarino resigns as CEO of Elon Musk's X social media platform.\",\n        \"has_basic_info\": true,\n        \"is_duplicate_of\": null,\n        \"is_past_event\": true,\n        \"source_url\": \"https://www.cnn.com/2025/07/09/tech/linda-yaccarino-steps-down-x-ceo\"\n    },\n    {\n        \"id\": 7,\n        \"title\": \"X's Tumultuous Journey under Elon Musk\",\n        \"date\": \"2025-07-09\",\n        \"time\": null,\n        \"location\": null,\n        \"organizer\": null,\n        \"access_req\": \"unknown\",\n        \"summary\": \"CEO Linda Yaccarino steps down from Elon Musk's X in a surprise move.\",\n        \"has_basic_info\": false,\n        \"is_duplicate_of\": null,\n        \"is_past_event\": true,\n        \"source_url\": \"https://www.reuters.com/business/autos-transportation/xs-tumultuous-journey-under-elon-musk-2025-07-09/\"\n    },\n    {\n        \"id\": 8,\n        \"title\": \"Judge Blocks Trump FTC's 'Retaliation' against Media Matters\",\n        \"date\": \"2025-08-16\",\n        \"time\": null,\n        \"location\": null,\n        \"organizer\": null,\n        \"access_req\": \"unknown\",\n        \"summary\": \"Federal judge halts Trump administration's probe of Media Matters and Elon Musk's X.\",\n        \"has_basic_info\": false,\n        \"is_duplicate_of\": null,\n        \"is_past_event\": false,\n        \"source_url\": \"https://www.cnn.com/2025/08/16/media/ftc-trump-media-matters-elon-musk-judge-order\"\n    },\n    {\n        \"id\": 9,\n        \"title\": \"X Removes Posts by Musk Chatbot Grok after Antisemitism Complaints\",\n        \"date\": \"2025-07-09\",\n        \"time\": \"03:44\",\n        \"location\": null,\n        \"organizer\": null,\n        \"access_req\": \"unknown\",\n        \"summary\": \"Posts by Grok chatbot on X account removed due to antisemitism complaints.\",\n        \"has_basic_info\": true,\n        \"is_duplicate_of\": null,\n        \"is_past_event\": true,\n        \"source_url\": \"https://www.reuters.com/technology/musk-chatbot-grok-removes-posts-after-complaints-antisemitism-2025-07-09/\"\n    },\n    {\n        \"id\": 10,\n        \"title\": \"Protests over Trump's Immigration Crackdown\",\n        \"date\": \"2025-06-13\",\n        \"time\": \"07:00\",\n        \"location\": \"Los Angeles, NYC, Seattle, Austin, Spokane\",\n        \"organizer\": null,\n        \"access_req\": \"unknown\",\n        \"summary\": \"Protests against Trump's immigration policies erupt in major US cities.\",\n        \"has_basic_info\": true,\n        \"is_duplicate_of\": null,\n        \"is_past_event\": true,\n        \"source_url\": \"https://www.cnn.com/us/live-news/la-protests-ice-raids-trump-06-12-25\"\n    }\n]\n```",
  "parsed_events": [
    {
      "id": 1,
      "title": "Zohran Mamdani at Juneteenth Festival in Queens",
      "date": "2025-06-23",
      "time": null,
      "location": "Queens, NYC",
      "organizer": null,
      "access_req": "unknown",
      "summary": "Zohran Mamdani attracting crowds at Juneteenth festival in Queens.",
      "has_basic_info": false,
      "is_duplicate_of": null,
      "is_past_event": true,
      "source_url": "https://www.cnn.com/2025/06/23/politics/zohran-mamdani-mayor-new-york-city-primary"
    },
    {
      "id": 2,
      "title": "Nicole Collier's Protest at Texas House Floor",
      "date": "2025-08-19",
      "time": null,
      "location": "Texas House floor, Texas",
      "organizer": null,
      "access_req": "unknown",
      "summary": "Rep. Nicole Collier protests on Texas House floor overnight.",
      "has_basic_info": false,
      "is_duplicate_of": null,
      "is_past_event": false,
      "source_url": "https://www.cnn.com/2025/08/19/politics/video/texas-democrat-nicole-collier-sleeps-texas-house-floor-redistricting-digvid"
    },
    {
      "id": 3,
      "title": "Elon Musk's X Refuses Cooperation with French Probe",
      "date": "2025-07-21",
      "time": "08:53",
      "location": "France",
      "organizer": null,
      "access_req": "unknown",
      "summary": "Musk's X denies cooperation with 'politically motivated' French probe.",
      "has_basic_info": true,
      "is_duplicate_of": null,
      "is_past_event": true,
      "source_url": "https://www.reuters.com/legal/litigation/musks-x-says-it-wont-cooperate-with-politically-motivated-french-probe-2025-07-21/"
    },
    {
      "id": 4,
      "title": "X Ads Tools for Business",
      "date": null,
      "time": null,
      "location": null,
      "organizer": null,
      "access_req": "unknown",
      "summary": "Twitter offers tools for businesses to reach their target audience.",
      "has_basic_info": false,
      "is_duplicate_of": null,
      "is_past_event": false,
      "source_url": "https://ads.twitter.com/getstarted"
    },
    {
      "id": 5,
      "title": "X API Tools for Developers",
      "date": null,
      "time": null,
      "location": null,
      "organizer": null,
      "access_req": "unknown",
      "summary": "Developers can access Twitter's API tools to build innovative applications.",
      "has_basic_info": false,
      "is_duplicate_of": null,
      "is_past_event": false,
      "source_url": "https://developer.twitter.com/apitools/"
    },
    {
      "id": 6,
      "title": "Linda Yaccarino Steps Down as X CEO",
      "date": "2025-07-09",
      "time": "14:49",
      "location": "Elon Musk's X, NYC",
      "organizer": null,
      "access_req": "unknown",
      "summary": "Linda Yaccarino resigns as CEO of Elon Musk's X social media platform.",
      "has_basic_info": true,
      "is_duplicate_of": null,
      "is_past_event": true,
      "source_url": "https://www.cnn.com/2025/07/09/tech/linda-yaccarino-steps-down-x-ceo"
    },
    {
      "id": 7,
      "title": "X's Tumultuous Journey under Elon Musk",
      "date": "2025-07-09",
      "time": null,
      "location": null,
      "organizer": null,
      "access_req": "unknown",
      "summary": "CEO Linda Yaccarino steps down from Elon Musk's X in a surprise move.",
      "has_basic_info": false,
      "is_duplicate_of": null,
      "is_past_event": true,
      "source_url": "https://www.reuters.com/business/autos-transportation/xs-tumultuous-journey-under-elon-musk-2025-07-09/"
    },
    {
      "id": 8,
      "title": "Judge Blocks Trump FTC's 'Retaliation' against Media Matters",
      "date": "2025-08-16",
      "time": null,
      "location": null,
      "organizer": null,
      "access_req": "unknown",
      "summary": "Federal judge halts Trump administration's probe of Media Matters and Elon Musk's X.",
      "has_basic_info": false,
      "is_duplicate_of": null,
      "is_past_event": false,
      "source_url": "https://www.cnn.com/2025/08/16/media/ftc-trump-media-matters-elon-musk-judge-order"
    },
    {
      "id": 9,
      "title": "X Removes Posts by Musk Chatbot Grok after Antisemitism Complaints",
      "date": "2025-07-09",
      "time": "03:44",
      "location": null,
      "organizer": null,
      "access_req": "unknown",
      "summary": "Posts by Grok chatbot on X account removed due to antisemitism complaints.",
      "has_basic_info": true,
      "is_duplicate_of": null,
      "is_past_event": true,
      "source_url": "https://www.reuters.com/technology/musk-chatbot-grok-removes-posts-after-complaints-antisemitism-2025-07-09/"
    },
    {
      "id": 10,
      "title": "Protests over Trump's Immigration Crackdown",
      "date": "2025-06-13",
      "time": "07:00",
      "location": "Los Angeles, NYC, Seattle, Austin, Spokane",
      "organizer": null,
      "access_req": "unknown",
      "summary": "Protests against Trump's immigration policies erupt in major US cities.",
      "has_basic_info": true,
      "is_duplicate_of": null,
      "is_past_event": true,
      "source_url": "https://www.cnn.com/us/live-news/la-protests-ice-raids-trump-06-12-25"
    }
  ],
  "token_usage": {
    "completion_tokens": 1473,
    "prompt_tokens": 5944,
    "total_tokens": 7417,
    "completion_tokens_details": {
      "accepted_prediction_tokens": 0,
      "audio_tokens": 0,
      "reasoning_tokens": 0,
      "rejected_prediction_tokens": 0
    },
    "prompt_tokens_details": {
      "audio_tokens": 0,
      "cached_tokens": 0
    }
  },
  "estimated_cost": 0.0017754000000000001
}