{
  "timestamp": "20250819_101638",
  "model": "gpt-3.5-turbo",
  "prompt_preview": "You are a newsroom fact-checker verifying event information for photojournalists.\n\nCURRENT DATE: 2025-08-19\n\nPRIMARY TASK: Extract unique events with complete, actionable information that photographers can use to plan their coverage.\n\nEVENTS TO PROCESS:\n[\n  {\n    \"id\": 1,\n    \"url\": \"https://www.un.org/en/ga/\",\n    \"title\": \"General Assembly of the United Nations\",\n    \"snippet\": \"The UN General Assembly (UNGA) is the main policy-making organ of the Organization. Comprising all Member States, it...",
  "raw_response": "```json\n[\n    {\n        \"id\": 1,\n        \"title\": \"General Assembly of the United Nations\",\n        \"date\": null,\n        \"time\": null,\n        \"location\": null,\n        \"organizer\": \"United Nations\",\n        \"access_req\": \"unknown\",\n        \"summary\": \"Main policy-making organ of the United Nations, provides a forum for multilateral discussions.\",\n        \"has_basic_info\": false,\n        \"is_duplicate_of\": null,\n        \"is_past_event\": false,\n        \"source_url\": \"https://www.un.org/en/ga/\"\n    },\n    {\n        \"id\": 2,\n        \"title\": \"General Assembly High-level Week 2024 - the United Nations\",\n        \"date\": null,\n        \"time\": null,\n        \"location\": null,\n        \"organizer\": \"United Nations\",\n        \"access_req\": \"unknown\",\n        \"summary\": \"Marks a crucial milestone in global efforts towards Sustainable Development Goals.\",\n        \"has_basic_info\": false,\n        \"is_duplicate_of\": null,\n        \"is_past_event\": false,\n        \"source_url\": \"https://www.un.org/en/high-level-week-2024\"\n    },\n    {\n        \"id\": 3,\n        \"title\": \"The best NYC events in August 2025 - Time Out\",\n        \"date\": null,\n        \"time\": null,\n        \"location\": null,\n        \"organizer\": \"Time Out\",\n        \"access_req\": \"unknown\",\n        \"summary\": \"Cultural festivals, live music, dining, and outdoor adventures in NYC for August 2025.\",\n        \"has_basic_info\": false,\n        \"is_duplicate_of\": null,\n        \"is_past_event\": false,\n        \"source_url\": \"https://www.timeout.com/newyork/events-calendar/august-events-calendar\"\n    },\n    {\n        \"id\": 4,\n        \"title\": \"Meetings of the General Assembly of the United Nations\",\n        \"date\": null,\n        \"time\": null,\n        \"location\": null,\n        \"organizer\": \"United Nations\",\n        \"access_req\": \"unknown\",\n        \"summary\": \"Follow General Assembly meetings live and on demand on UN WebTV.\",\n        \"has_basic_info\": false,\n        \"is_duplicate_of\": null,\n        \"is_past_event\": false,\n        \"source_url\": \"https://www.un.org/en/ga/meetings/\"\n    },\n    {\n        \"id\": 5,\n        \"title\": \"2025 Calendar of Selected United Nations Events\",\n        \"date\": null,\n        \"time\": null,\n        \"location\": null,\n        \"organizer\": \"United Nations\",\n        \"access_req\": \"unknown\",\n        \"summary\": \"Secretary-General briefs General Assembly on 2025 priorities and various committee meetings.\",\n        \"has_basic_info\": false,\n        \"is_duplicate_of\": null,\n        \"is_past_event\": false,\n        \"source_url\": \"https://www.un.org/en/academic-impact/2025-calendar-selected-united-nations-events\"\n    },\n    {\n        \"id\": 6,\n        \"title\": \"The Week Ahead at the United Nations\",\n        \"date\": null,\n        \"time\": null,\n        \"location\": null,\n        \"organizer\": \"United Nations\",\n        \"access_req\": \"unknown\",\n        \"summary\": \"2025 session of the Conference on Disarmament continues until September 12.\",\n        \"has_basic_info\": false,\n        \"is_duplicate_of\": null,\n        \"is_past_event\": false,\n        \"source_url\": \"https://www.un.org/sg/en/content/the-week-ahead-the-united-nations\"\n    },\n    {\n        \"id\": 7,\n        \"title\": \"General Assembly High-level Week 2025 | United Nations\",\n        \"date\": null,\n        \"time\": null,\n        \"location\": null,\n        \"organizer\": \"United Nations\",\n        \"access_req\": \"unknown\",\n        \"summary\": \"Highlights the urgency of delivering on the promise of the Sustainable Development Goals.\",\n        \"has_basic_info\": false,\n        \"is_duplicate_of\": null,\n        \"is_past_event\": false,\n        \"source_url\": \"https://www.un.org/en/high-level-week-2025\"\n    },\n    {\n        \"id\": 8,\n        \"title\": \"Best NYC Events in September 2025 Including Fall Happenings\",\n        \"date\": null,\n        \"time\": null,\n        \"location\": null,\n        \"organizer\": \"Time Out\",\n        \"access_req\": \"unknown\",\n        \"summary\": \"NYC events in September range from summer excursions to fall celebrations.\",\n        \"has_basic_info\": false,\n        \"is_duplicate_of\": null,\n        \"is_past_event\": false,\n        \"source_url\": \"https://www.timeout.com/newyork/events-calendar/september-events-calendar\"\n    },\n    {\n        \"id\": 9,\n        \"title\": \"New York Events and Things To Do All Year - Time Out\",\n        \"date\": null,\n        \"time\": null,\n        \"location\": null,\n        \"organizer\": \"Time Out\",\n        \"access_req\": \"unknown\",\n        \"summary\": \"NYC's best summer music festivals of 2025 featured in a guide by Time Out.\",\n        \"has_basic_info\": false,\n        \"is_duplicate_of\": null,\n        \"is_past_event\": false,\n        \"source_url\": \"https://www.timeout.com/newyork\"\n    },\n    {\n        \"id\": 10,\n        \"title\": \"NYC Events Calendar for 2025 Featuring the Best Things to Do\",\n        \"date\": null,\n        \"time\": null,\n        \"location\": null,\n        \"organizer\": \"Time Out\",\n        \"access_req\": \"unknown\",\n        \"summary\": \"NYC events calendar for 2025 including parades, concerts, films, and art exhibits.\",\n        \"has_basic_info\": false,\n        \"is_duplicate_of\": null,\n        \"is_past_event\": false,\n        \"source_url\": \"https://www.timeout.com/newyork/events-calendar\"\n    },\n    {\n        \"id\": 11,\n        \"title\": \"NYC DOT Weekend Traffic Advisory - NYC.gov\",\n        \"date\": null,\n        \"time\": null,\n        \"location\": null,\n        \"organizer\": \"NYC Department of Transportation\",\n        \"access_req\": \"unknown\",\n        \"summary\": \"Street closures for mobile crane, concrete pump, and knuckle boom use through July 31, 2025.\",\n        \"has_basic_info\": false,\n        \"is_duplicate_of\": null,\n        \"is_past_event\": false,\n        \"source_url\": \"https://www.nyc.gov/html/dot/html/motorist/wkndtraf.shtml\"\n    }\n]\n```  ",
  "parsed_events": [
    {
      "id": 1,
      "title": "General Assembly of the United Nations",
      "date": null,
      "time": null,
      "location": null,
      "organizer": "United Nations",
      "access_req": "unknown",
      "summary": "Main policy-making organ of the United Nations, provides a forum for multilateral discussions.",
      "has_basic_info": false,
      "is_duplicate_of": null,
      "is_past_event": false,
      "source_url": "https://www.un.org/en/ga/"
    },
    {
      "id": 2,
      "title": "General Assembly High-level Week 2024 - the United Nations",
      "date": null,
      "time": null,
      "location": null,
      "organizer": "United Nations",
      "access_req": "unknown",
      "summary": "Marks a crucial milestone in global efforts towards Sustainable Development Goals.",
      "has_basic_info": false,
      "is_duplicate_of": null,
      "is_past_event": false,
      "source_url": "https://www.un.org/en/high-level-week-2024"
    },
    {
      "id": 3,
      "title": "The best NYC events in August 2025 - Time Out",
      "date": null,
      "time": null,
      "location": null,
      "organizer": "Time Out",
      "access_req": "unknown",
      "summary": "Cultural festivals, live music, dining, and outdoor adventures in NYC for August 2025.",
      "has_basic_info": false,
      "is_duplicate_of": null,
      "is_past_event": false,
      "source_url": "https://www.timeout.com/newyork/events-calendar/august-events-calendar"
    },
    {
      "id": 4,
      "title": "Meetings of the General Assembly of the United Nations",
      "date": null,
      "time": null,
      "location": null,
      "organizer": "United Nations",
      "access_req": "unknown",
      "summary": "Follow General Assembly meetings live and on demand on UN WebTV.",
      "has_basic_info": false,
      "is_duplicate_of": null,
      "is_past_event": false,
      "source_url": "https://www.un.org/en/ga/meetings/"
    },
    {
      "id": 5,
      "title": "2025 Calendar of Selected United Nations Events",
      "date": null,
      "time": null,
      "location": null,
      "organizer": "United Nations",
      "access_req": "unknown",
      "summary": "Secretary-General briefs General Assembly on 2025 priorities and various committee meetings.",
      "has_basic_info": false,
      "is_duplicate_of": null,
      "is_past_event": false,
      "source_url": "https://www.un.org/en/academic-impact/2025-calendar-selected-united-nations-events"
    },
    {
      "id": 6,
      "title": "The Week Ahead at the United Nations",
      "date": null,
      "time": null,
      "location": null,
      "organizer": "United Nations",
      "access_req": "unknown",
      "summary": "2025 session of the Conference on Disarmament continues until September 12.",
      "has_basic_info": false,
      "is_duplicate_of": null,
      "is_past_event": false,
      "source_url": "https://www.un.org/sg/en/content/the-week-ahead-the-united-nations"
    },
    {
      "id": 7,
      "title": "General Assembly High-level Week 2025 | United Nations",
      "date": null,
      "time": null,
      "location": null,
      "organizer": "United Nations",
      "access_req": "unknown",
      "summary": "Highlights the urgency of delivering on the promise of the Sustainable Development Goals.",
      "has_basic_info": false,
      "is_duplicate_of": null,
      "is_past_event": false,
      "source_url": "https://www.un.org/en/high-level-week-2025"
    },
    {
      "id": 8,
      "title": "Best NYC Events in September 2025 Including Fall Happenings",
      "date": null,
      "time": null,
      "location": null,
      "organizer": "Time Out",
      "access_req": "unknown",
      "summary": "NYC events in September range from summer excursions to fall celebrations.",
      "has_basic_info": false,
      "is_duplicate_of": null,
      "is_past_event": false,
      "source_url": "https://www.timeout.com/newyork/events-calendar/september-events-calendar"
    },
    {
      "id": 9,
      "title": "New York Events and Things To Do All Year - Time Out",
      "date": null,
      "time": null,
      "location": null,
      "organizer": "Time Out",
      "access_req": "unknown",
      "summary": "NYC's best summer music festivals of 2025 featured in a guide by Time Out.",
      "has_basic_info": false,
      "is_duplicate_of": null,
      "is_past_event": false,
      "source_url": "https://www.timeout.com/newyork"
    },
    {
      "id": 10,
      "title": "NYC Events Calendar for 2025 Featuring the Best Things to Do",
      "date": null,
      "time": null,
      "location": null,
      "organizer": "Time Out",
      "access_req": "unknown",
      "summary": "NYC events calendar for 2025 including parades, concerts, films, and art exhibits.",
      "has_basic_info": false,
      "is_duplicate_of": null,
      "is_past_event": false,
      "source_url": "https://www.timeout.com/newyork/events-calendar"
    },
    {
      "id": 11,
      "title": "NYC DOT Weekend Traffic Advisory - NYC.gov",
      "date": null,
      "time": null,
      "location": null,
      "organizer": "NYC Department of Transportation",
      "access_req": "unknown",
      "summary": "Street closures for mobile crane, concrete pump, and knuckle boom use through July 31, 2025.",
      "has_basic_info": false,
      "is_duplicate_of": null,
      "is_past_event": false,
      "source_url": "https://www.nyc.gov/html/dot/html/motorist/wkndtraf.shtml"
    }
  ],
  "token_usage": {
    "completion_tokens": 1423,
    "prompt_tokens": 5704,
    "total_tokens": 7127,
    "completion_tokens_details": {
      "accepted_prediction_tokens": 0,
      "audio_tokens": 0,
      "reasoning_tokens": 0,
      "rejected_prediction_tokens": 0
    },
    "prompt_tokens_details": {
      "audio_tokens": 0,
      "cached_tokens": 0
    }
  },
  "estimated_cost": 0.0017094
}